{
    "items": [
        {
            "question": {
                "code": "EXPSmo",
                "text": "Have you smoked since the last time you recorded anything on the phone?"
            },
            "answer": {
                "code": 1,
                "text": "yes"
            },
            "start_time_frame": {
                "date_time": "2015-02-05T07:22:10Z"
            },
            "end_time_frame": {
                "date_time": "2015-02-05T07:25:10Z"
            }
        },
        {
            "question": {
                "code": "EXPSmoLat",
                "text": "Approximately how long ago did you take the first puff from that cigarette?"
            },
            "answer": 60,
            "start_time_frame": {
                "date_time": "2015-02-05T07:27:10Z"
            },
            "end_time_frame": {
                "date_time": "2015-02-05T07:30:10Z"
            }
        },
        {
            "question": {
                "code": "EXPInt",
                "text": "Have you received a stress-reduction suggestion on your watch since the last time you recorded anything on the phone?"
            },
            "answer": {
                "code": 1,
                "text": "yes"
            },
            "start_time_frame": {
                "date_time": "2015-02-05T07:33:10Z"
            },
            "end_time_frame": {
                "date_time": "2015-02-05T07:36:10Z"
            }
        },
        {
            "question": {
                "code": "EXPIntUse",
                "text": "Did you access any of the stress reduction apps on the phone?"
            },
            "answer": {
                "code": 1,
                "text": "yes"
            },
            "start_time_frame": {
                "date_time": "2015-02-05T07:38:10Z"
            },
            "end_time_frame": {
                "date_time": "2015-02-05T07:42:10Z"
            }
        },
        {
            "question": {
                "code": "EXPIntHelp",
                "text": "How useful did you find the stress reduction app?"
            },
            "answer": {
                "code": 2,
                "text": "somewhat useful"
            },
            "start_time_frame": {
                "date_time": "2015-02-05T07:45:10Z"
            },
            "end_time_frame": {
                "date_time": "2015-02-05T07:50:10Z"
            }
        },
        {
            "question": {
                "code": "EXPIntSR",
                "text": "Did you use any of the stress reduction exercises (with or without the app) since the last time you recorded anything on the phone?"
            },
            "answer": {
                "code": 0,
                "text": "no"
            },
            "start_time_frame": {
                "date_time": "2015-02-05T07:52:10Z"
            },
            "end_time_frame": {
                "date_time": "2015-02-05T08:00:10Z"
            }
        }
    ],
    "first_delivered_date_time": "2015-02-05T07:24:00Z",
    "status": "successful",
    "trigger": "random"
}
